4,"Emma Watson and Millie Bobby Brown met at MTV Movie & TV Awards, and it was adorable","Hugh Jackman wa there , too",http://ew.com/tv/2017/05/07/mtv-movie-tv-awards-millie-bobby-brown-emma-watson-hugh-jackman/,entertainment-weekly
4,MTV Movie & TV Awards: ‘Stranger Things’ wins Show of the Year,MTV Movi & TV Award : ‘Stranger Things’ win Show of the Year,http://ew.com/awards/2017/05/07/mtv-movie-tv-awards-2017-best-show-stranger-things/,entertainment-weekly
4,Colin Farrell talks 10 years of sobriety with Ellen DeGeneres,The actor get a round of applaus,http://ew.com/tv/2017/05/07/colin-farrell-sobriety-ellen-degeneres/,entertainment-weekly
4,’13 Reasons Why’ cast presents at the MTV Movie & TV Awards,"Fresh off their season 2 renew , the cast bestow 'Stranger Thing ' with the night 's top award",http://ew.com/tv/2017/05/07/13-reasons-why-cast-mtv-movie-tv-awards/,entertainment-weekly
4,‘Beauty and the Beast’ wins movie of the year at 2017 MTV Movie and TV Awards,‘Beauti and the Beast’ win movi of the year at 2017 MTV Movi and TV Award,http://ew.com/movies/2017/05/07/beauty-and-the-beast-movie-of-the-year-mtv-movie-tv-awards-2017/,entertainment-weekly
6,"Obama Defends Affordable Care Act, but Leaves Trump Out of It","In remark at the John F. Kennedi Presidenti Librari , Mr. Obama made onli a glanc refer to the recent vote to dismantl hi signatur legisl .",https://www.nytimes.com/2017/05/07/us/politics/obama-trump-health-care.html,google-news
6,China pitch by Kushner sister renews controversy over visa program for wealthy,Compani “apologizes” if refer to Jare Kushner seen as “attempt to lure investors”,https://www.washingtonpost.com/politics/china-pitch-by-kushner-sister-renews-controversy-over-visa-program-for-wealthy/2017/05/07/59d18360-3357-11e7-b412-62beef8121f7_story.html,google-news
4,MTV Movie & TV Awards: Best and Worst Moments,"Milli Bobbi Brown get emot , a 'Beauti and the Beast ' homag and gender-neutr act award were among the most memor moment from Sunday night 's show .",http://www.hollywoodreporter.com/lists/mtv-movie-tv-awards-best-worst-moments-1001005,google-news
3,Leader of ISIS Branch in Afghanistan Killed in Special Forces Raid,"The Afghan president’ offic and the Unit State militari command said that Abdul Hasib , who recent took over as head of the Islam State’ affili in Afghanistan , die in an April oper .",https://www.nytimes.com/2017/05/07/world/asia/abdul-hasib-isis-leader-killed.html,google-news
6,Appeals Court to Take Up Revised Trump Travel Restrictions,The govern is urg an appeal court to lift a stay block the Trump administr from carri out the execut order .,http://www.nbcnews.com/news/us-news/appeals-court-take-revised-trump-travel-restrictions-n756081,google-news
4,"Into the Badlands: ""Sting of the Scorpion's Tail"" Review - IGN",There wa plenti of chao in the Badland thi week as Widow and Quinn join forc against the Baron .,http://ca.ign.com/articles/2017/05/08/into-the-badlands-sting-of-the-scorpions-tail-review,ign
4,Adam Warlock Explained: Who Is the Guardians of the Galaxy Character? - IGN,"Jame Gunn ha said he 's develop Adam Warlock for the MCU , so we break down everyth you need to know about thi cosmic savior .",http://ca.ign.com/articles/2017/05/02/adam-warlock-explained-who-is-the-guardians-of-the-galaxy-character,ign
4,"American Gods: ""The Secret of Spoons"" Review - IGN",Shadow Moon and Mr. Wednesday begin their journey in the second episod of American God .,http://ca.ign.com/articles/2017/05/08/american-gods-the-secret-of-spoons-review,ign
4,"The Leftovers: ""G'Day Melbourne"" Review - IGN",Kevin and Nora head to Australia and embark on separ emot hectic adventur in a fantast episod .,http://ca.ign.com/articles/2017/05/08/the-leftovers-gday-melbourne-review,ign
4,Micro Machines World Series: The Resurrection of Racing Royalty - IGN,How Codemast is bring back a true pioneer of social game .,http://ca.ign.com/articles/2017/05/08/micro-machines-world-series-the-resurrection-of-racing-royalty,ign
4,How Shadowverse Became a Major Player in the CCG Genre - IGN,Develop Cygam on build a highli competit card battler for mobil first .,http://ca.ign.com/articles/2017/05/08/how-shadowverse-became-a-major-player-in-the-ccg-genre,ign
4,Netflix Renews 13 Reasons Why for Season 2 - IGN,The thirteen-episod second season will debut on Netflix sometim in 2018 .,http://ca.ign.com/articles/2017/05/07/netflix-renews-13-reasons-why-for-season-2,ign
13,What’s behind the conflict between Google and Uber,A battl over the futur of self-driv car,http://www.economist.com/blogs/economist-explains/2017/05/economist-explains-4,the-economist
4,Who Is Emmanuel Macron?,"In three year , Emmanuel Macron , a pro-European newcom to elector polit , ha climb from a backstag role as a govern technocrat to France’ youngest-ev presid .",https://www.wsj.com/articles/who-is-emmanuel-macron-1494190952,the-wall-street-journal
4,France’s Emmanuel Macron Set to Clash With Rivals on World Stage,"French President-elect Emmanuel Macron , a consumm internationalist , head into offic prime for clash with two nationalist rival : U.S. Presid Donald Trump and Russian Presid Vladimir Putin .",https://www.wsj.com/articles/frances-emmanuel-macron-set-to-clash-with-rivals-on-world-stage-1494198270,the-wall-street-journal
4,Macron Win Slows March of Euroskeptics,The victori of Emmanuel Macron and hi upstart pro-European parti in Franc mark a signific pushback against nationalist parti that have challeng the exist of the European Union over the past year .,https://www.wsj.com/articles/macron-win-slows-march-of-euroskeptics-1494203479,the-wall-street-journal
4,"After Defeat, Marine Le Pen Emerges as Leader of French Opposition","Far-right nationalist Marin Le Pen suffer a sting defeat in the final round of France’ presidenti elect , but her show at the poll cement her statu as the leader of France’ polit opposit .",https://www.wsj.com/articles/after-defeat-marine-le-pen-emerges-as-leader-of-french-opposition-1494200459,the-wall-street-journal
6,"Euro Gains, Leaving Political Concerns Behind to Focus on Growth","The euro rose to a seven-month high against the dollar after Emmanuel Macron won the French presid on Sunday , a victori that should continu to boost the currenc as polit concern fade and investor focu on the eurozone’ econom recoveri .",https://www.wsj.com/articles/euro-gains-leaving-political-concerns-behind-to-focus-on-growth-1494188147,the-wall-street-journal
6,French Election Victor Emmanuel Macron’s ‘New Deal’ for Europe Faces Old German Doubts,Emmanuel Macron’ big idea for Europ is to deepen the euro currenc union. But to get what he want he will first have to convinc a skeptic Germani .,https://www.wsj.com/articles/french-election-victor-emmanuel-macron-will-have-to-address-challenges-in-push-to-deepen-eurozone-1494180712,the-wall-street-journal
4,Chinese-North Korean Venture Shows How Much Sanctions Can Miss,A state-own Chines firm and a North Korean compani blacklist for it involv with weapon of mass destruct had a partnership for nearli a decad to mine for miner use in missil product ; the Chines compani say the partnership never did much .,https://www.wsj.com/articles/chinese-north-korean-venture-shows-how-much-sanctions-can-miss-1494191212,the-wall-street-journal
4,White House Presses Insurance-Market Woes in Health Fight,The White Hous is hope to har insurance-market woe in some state to help lift the GOP’ health-car measur over the remain hurdl in Congress .,https://www.wsj.com/articles/white-house-presses-insurance-market-woes-in-health-fight-1494198868,the-wall-street-journal
3,"With Le Pen defeat, Europe’s far-right surge stalls","After Brexit and Trump , the predict anti-E.U. populist takeov hasn’t happen .",https://www.washingtonpost.com/world/europe/in-le-pen-defeat-europes-far-right-wave-crashes-to-a-halt/2017/05/07/e8edfa46-301f-11e7-a335-fa0ae1940305_story.html,the-washington-post
6,Emmanuel Macron’s unlikely path to the French presidency,"Despit all odd , an outsid won in France’ ossifi polit system. How did he do it ?",https://www.washingtonpost.com/world/europe/emmanuel-macrons-unlikely-path-to-the-french-presidency/2017/05/07/f8943ed8-bdc3-4ed4-8bbb-97a8781ff393_story.html,the-washington-post
3,Sally Yates to testify about her discussions with the White House on Russia,It will be the first public comment from the ex-Obama offici on the Russia probe after a lawmak cancel a previou hear .,https://www.washingtonpost.com/world/national-security/yates-to-testify-about-her-discussions-with-the-white-house-on-russia/2017/05/05/02a33032-31dd-11e7-9534-00e4656c22aa_story.html,the-washington-post
6,Obama calls on lawmakers to show ‘courage’ in health-care fight,"The former presid , in Boston to receiv the Profil in Courag Award on the 100th anniversari of Presid John F. Kennedy’ birth , call on Republican and Democrat lawmak to stand up for vulner American and to ensur they do not lose access to care .",https://www.washingtonpost.com/news/post-politics/wp/2017/05/07/obama-calls-on-lawmakers-to-show-courage-in-health-care-fight/,the-washington-post
15,Penn State student said frat brothers ignored pleas to help classmate who died after hazing,Timothi Piazza wa injur for more than 12 hour befor frat member call 911 .,https://www.washingtonpost.com/news/grade-point/wp/2017/05/07/penn-state-student-said-frat-brothers-ignored-pleas-to-help-classmate-who-died-after-hazing/,the-washington-post
13,Free-standing emergency rooms offer costly convenience,Some say the facil contribut to rise medic expens .,https://www.washingtonpost.com/business/economy/free-standing-emergency-rooms-offer-costly-convenience/2017/05/07/6255d052-2b98-11e7-b605-33413c691853_story.html,the-washington-post
4,Comcast and Charter won’t make wireless acquisitions without the other’s permission,For one year,https://www.theverge.com/2017/5/7/15575686/comcast-charter-deal-wireless-acquisitions-merger,the-verge
6,Macron Decisively Defeats Le Pen in French Presidential Race,Emmanuel Macron’ victori suggest that hi call for a new centrist approach to polit had handili defeat the nation of Marin Le Pen .,https://www.nytimes.com/2017/05/07/world/europe/emmanuel-macron-france-election-marine-le-pen.html,the-new-york-times
6,Highlights of the French Presidential Vote,The pro-European Emmanuel Macron’ victori over Marin Le Pen is anoth setback for far-right populist on the Contin .,https://www.nytimes.com/2017/05/07/world/europe/france-president-elections-le-pen-macron.html,the-new-york-times
13,Puerto Ricans Face ‘Sacrifice Everywhere’ on an Insolvent Island,"The territori , which file for a kind of bankruptci protect in the face of $ 123 billion in debt , ha been grip by a sens of gloom and anxieti .",https://www.nytimes.com/2017/05/06/us/puerto-rico-insolvency-business-owners-anxiety.html,the-new-york-times
6,Trump Looms as Kushner Companies Courts Investors in China,"A day after woo wealthi Chines in Beij , Jare Kushner’ famili firm offer attende in Shanghai a path toward live in the U.S. in exchang for invest .",https://www.nytimes.com/2017/05/07/business/trump-kushner-china-investors-visas.html,the-new-york-times
4,‘Morning Joe’ and Kellyanne Conway Are Mocked on ‘Saturday Night Live’,"The Trump “publicist” John Miller call into “Morn Joe” to brag about the presid on “S.N.L. , ” but Joe Scarborough and Mika Brzezinski were mostli focus on each other .",https://www.nytimes.com/2017/05/07/arts/television/snl-morning-joe-mika-kellyanne-conway.html,the-new-york-times
3,Trump insists he's not under FBI investigation,Hi remark come as the act FBI director tell Congress the Russian probe is `` highli signific '' .,http://www.bbc.co.uk/news/world-us-canada-39886496,bbc-news
6,General election 2017: Jeremy Corbyn says 'I'm not a pacifist',The Labour leader will say he accept militari action is sometim need `` as a last resort '' .,http://www.bbc.co.uk/news/election-2017-39892281,bbc-news
6,General election 2017: Theresa May targets Labour's 'deserted' working-class voters,The prime minist head to north-east England in a bid to `` reach out '' to Labour 's tradit voter .,http://www.bbc.co.uk/news/election-2017-39891663,bbc-news
3,Mexican who searched for 'disappeared' is killed,A Mexican woman who led a search for the disappear is kill after a gang member escap from jail .,http://www.bbc.co.uk/news/world-latin-america-39892553,bbc-news
13,UK virtual reality firm Improbable raises $500m,The London-bas Improb will remain independ follow the invest by Japan 's Softbank .,http://www.bbc.co.uk/news/business-39892251,bbc-news
3,Helicopter crew's shark warning to CA paddle-boarders,A sheriff 's helicopt crew warn paddle-board they are swim with shark off the California coast .,http://www.bbc.co.uk/news/av/world-us-canada-39891689/attention-you-are-next-to-15-great-whites,bbc-news
13,Deliveroo overhauls controversial courier contracts,The food deliveri firm remov a claus prevent rider from challeng their employ statu .,http://www.bbc.co.uk/news/business-39889995,bbc-news
3,"ICE arrests nearly 1,400 in major anti-gang operation",Some 900 of those detain in six-week nationwid gang dragnet were US citizen .,http://www.bbc.co.uk/news/world-us-canada-39891319,bbc-news
3,Copenhagen imam accused of calling for killing of Jews,A video emerg show a Copenhagen imam cite a hadith that call for Muslim to kill Jew .,http://www.bbc.co.uk/news/world-europe-39885745,bbc-news
9,Manchester United 1-1 Celta Vigo (2-1 agg),Manchest Unit surviv a huge late scare to edg past Celta Vigo and set up a Europa Leagu final against Dutch giant Ajax .,http://www.bbc.co.uk/sport/football/39877812,bbc-sport
9,Andy Murray: Madrid Open exit concerns world number one,World number one Andi Murray is `` concern '' follow hi defeat by Borna Coric at the Madrid Open but deni be low on confid .,http://www.bbc.co.uk/sport/tennis/39891424,bbc-sport
9,Players Championship: Adam Scott blows chance of opening round lead,Adam Scott drop four shot over the last two hole as he blow a chanc to take a first-round lead at the Player Championship .,http://www.bbc.co.uk/sport/golf/39892487,bbc-sport
9,World Triathlon Series: Jonny Brownlee aims to put 2016 'hurt' behind him,Britain 's Jonni Brownle say he is `` hungri '' to put the `` hurt '' of last year 's World Seri final behind him .,http://www.bbc.co.uk/sport/triathlon/39887253,bbc-sport
9,US Open qualifying: Golfer scores 127 at event in Alabama,An American golfer fail to score a singl par and manag just two bogey as he score 127 in US Open local qualifi .,http://www.bbc.co.uk/sport/golf/39892101,bbc-sport
9,Spanish Grand Prix: Lewis Hamilton turning Russia 'pain' into a 'positive',Lewi Hamilton say he ha learn from hi difficult weekend at the Russian Grand Prix and hope Sunday 's race in Spain will be better .,http://www.bbc.co.uk/sport/formula1/39884635,bbc-sport
9,Lyon 3-1 Ajax (agg 4-5),Ajax resist a tenaci second-leg fightback by Lyon and reach the Europa Leagu final - their first European final sinc 1996 .,http://www.bbc.co.uk/sport/football/39875313,bbc-sport
9,"BBC Women's Footballer of the Year 2017: Christine Sinclair on being related to Canada's Prime Minister, breaking Mia Hamm's record and Steven Gerrard",Portland Thorn striker Christin Sinclair is hope to win the covet BBC Women 's Footbal of the Year 2017 award .,http://www.bbc.co.uk/sport/football/39846571,bbc-sport
9,One-Day Cup: Alex Hales smashes six into BBC commentary box,Listen as Nott open Alex Hale smash a six into the BBC commentari box in hi side 's One-Day Cup match with Durham at Trent Bridg .,http://www.bbc.co.uk/sport/cricket/39888469,bbc-sport
6,Trump Ordered to Turn Over Giuliani Memo in Travel Ban Suit,The Trump Administr wa order by a feder judg to disclos a memo draft under the guidanc of former New York Citi Mayor Rudi Giuliani that allegedli serv as an outlin to make the president’ travel ban look like it wasn’t aim at Muslim .,https://www.bloomberg.com/politics/articles/2017-05-11/trump-ordered-to-turn-over-giuliani-memo-in-travel-ban-suit,bloomberg
4,Coke’s New CEO Must Win Over a New Generation That Shuns Sugar,"Jame Quincey on energi drink , stay-at-hom consum , and the etern quest for a better sweeten .",https://www.bloomberg.com/news/articles/2017-05-11/coke-s-new-ceo-must-win-over-a-new-generation-that-shuns-sugar,bloomberg
4,Kushner Family Backs Out of Planned China Event for Investors,"The compani belong to Jare Kushner’ famili is pull out of a present to investor in China follow critic that hi sister invok hi work for hi father-in-law , Presid Donald Trump , in a similar pitch last weekend .",https://www.bloomberg.com/news/articles/2017-05-11/kushner-family-backs-out-of-planned-china-event-for-investors-j2kzkgg7,bloomberg
4,Republican Strategy Firm in Maryland Raided by FBI: Reports,"The Feder Bureau of Investigation carri out a raid on a Republican fundrais firm in Maryland that had been accus in a 2014 lawsuit of defraud polit donor , accord to sever area news outlet .",https://www.bloomberg.com/news/articles/2017-05-11/republican-fundraising-firm-in-maryland-raided-by-fbi-reports,bloomberg
6,The Economist Who Helped Write Trump’s Tax Plan in Five Days,Shahira Knight know her way around Congress .,https://www.bloomberg.com/news/articles/2017-05-11/the-economist-who-helped-write-trump-s-tax-plan-in-five-days,bloomberg
4,Fed Plan for Gradual Rate Hikes Is Starting to Look Complacent,Global growth outlook improv as central bank keep real rate neg with inflat and unemploy on target,https://www.bloomberg.com/news/articles/2017-05-11/case-for-faster-fed-rate-hikes-builds-as-bond-markets-sleep,bloomberg
4,Jay Z Signs $200M Touring Deal With Live Nation,"New York ( AP ) -- Jay Z ha sign a $ 200 million , 10-year deal with tour promot Live Nation .",https://www.bloomberg.com/news/articles/2017-05-11/ap-source-jay-z-signs-200m-touring-deal-with-live-nation,bloomberg
4,Cruises Could Be Big Winners in Cuba,The once-taboo island lack tourist infrastructure. Ship oper hope to chang that .,https://www.bloomberg.com/news/articles/2017-05-11/cruises-could-be-big-winners-in-cuba,bloomberg
4,Cigna Wins Judge's Approval to Walk Away From Anthem Merger,"Cigna Corp. can walk away from it $ 48 billion merger with Anthem Inc. , a Delawar judg rule almost three month after anoth court block the deal as anticompetit .",https://www.bloomberg.com/news/articles/2017-05-11/cigna-wins-judge-s-approval-to-walk-away-from-anthem-merger,bloomberg
4,Here’s a Really Expensive Way to Start Your Own Business,MBA program push entrepreneuri skill employ don’t want .,https://www.bloomberg.com/news/articles/2017-05-11/top-b-schools-are-pushing-entrepreneurship,bloomberg
6,'Really?!': Reporters mercilessly grill White House spokeswoman over ever-shifting claims on James Comey firing,Sander wa grill dure Thursday 's brief — one that came on the heel of sever storylin be disproven by the like of McCabe and even Trump .,http://www.businessinsider.com/sarah-huckabee-sanders-trump-james-comey-firing-2017-5,business-insider
4,"Yes, that's J. Peterman from 'Seinfeld' pitching an IPO on TV — no, that's not the most surprising thing about it","YayYo is advertis it IPO on TV , someth the SEC allows. But the way YayYo share are be market could be problemat , expert say .",http://www.businessinsider.com/yayyo-ipo-ads-tv-ramy-el-batrawi-sec-rule-jobs-act-2017-5,business-insider
6,Trump emphatically denies collusion with Russia in first interview since firing FBI director,It wa Trump 's strongest denounc yet of the topic that ha hound hi presid .,http://www.businessinsider.com/trump-russia-collusion-lester-holt-interview-nbc-news-2017-5,business-insider
6,We now know more about the final straw that drove Trump to fire Comey,The White Hous ha been scrambl to explain whi Presid Donald Trump fire FBI Director Jame Comey on Tuesday .,http://www.businessinsider.com/why-did-trump-fire-comey-fbi-director-2017-5,business-insider
6,A top Republican senator is pitching an out-of-the-box idea to replace James Comey — and top White House officials are into it,Mike Lee garner attent Thursday after tweet that Presid Donald Trump should appoint Merrick Garland to replac Jame Comey as FBI director .,http://www.businessinsider.com/merrick-garland-fbimike-lee-pence-trump-james-comey-2017-5,business-insider
13,10 of the best things Evan Spiegel said on Snap's first ever earnings call,"Snapchat 's Q1 earn call wa the public 's first real chanc to hear from Evan Spiegel , the compani 's reclus 26-year old cofound and CEO .",http://www.businessinsider.com/10-of-the-best-things-evan-spiegel-said-on-snaps-first-ever-earning-call-2017-5,business-insider
6,Trump contradicts spokeswoman on effect of Comey firing,"Presid Donald Trump said Thursday that he fear hi fire of FBI Director Jame Comey could confus American , but went ahead with the plan anyway .",http://www.cnn.com/2017/05/11/politics/comey-fbi-investigation-russia-sarah-huckabee-sanders/index.html,cnn
6,Timeline: Trump's words contradict White House answers on Comey firing,The White Hous ca n't get it stori straight on whi Presid Donald Trump fire FBI Director Jame Comey .,http://www.cnn.com/2017/05/11/politics/trump-comey-white-house-contradictions/index.html,cnn
6,Trump: Russia story made up by Democrats - CNN Video,Presid Donald Trump told NBC News ' Lester Holt that ani tie between Trump and Russia is a stori fabric by Democrat to use as an excus for lose the 2016 elect .,http://www.cnn.com/videos/politics/2017/05/11/trump-nbc-news-russia-a-made-up-story-by-democrats-sot.cnn,cnn
6,Fact-checking Trump's claim on FBI turmoil - CNN Video,CNN 's Jake Tapper and factcheck.org examin Presid Trump 's interview with NBC 's Lester Holt about the fire of FBI director Jame Comey. Read more .,http://www.cnn.com/videos/politics/2017/05/11/fact-checking-trumps-claim-on-fbi-turmoil-orig-ct.cnn,cnn
6,Could Trump have obstructed justice?,"If Trump 's real reason for fire Comey wa to derail the FBI investig into possibl collus , hi action could constitut a feloni , say Jimmi Gurulé .",http://www.cnn.com/2017/05/11/opinions/trump-obstruction-of-justice-gurule-opinion/index.html,cnn
6,Plane in Air Force One fleet was at risk of catching fire,"Three Boe mechan caus $ 4 million of damag and could have spark a mid-flight fire while repair one of the plane in the Air Forc One fleet , a feder investig ha found .",http://www.cnn.com/2017/05/11/politics/boeing-air-force-one-mechanics-contamination/index.html,cnn
6,ICE announces major anti-gang operation,"Immigr and Custom Enforc announc it largest anti-gang oper ever on Thursday , a six-week oper that net more than 1,300 arrest nationwid .",http://www.cnn.com/2017/05/11/politics/ice-gang-arrests-operation/index.html,cnn
4,Fossil hopes you’ll like one of its 300 smartwatches,"There are 300 of them from brand like Misfit , Skagen and Fossil 's own .",https://www.engadget.com/2017/05/11/fossil-skagen-misfit-hybrid-smartwatches-hands-on/,engadget
4,'Fire Island' Recap: All the Tea About Tea Dances,None of these guy know how to throw a parti .,http://ew.com/recap/fire-island-season-1-episode-4/,entertainment-weekly
4,‘The Big Bang Theory’ boss on Amy and Sheldon’s next step,‘The Big Bang Theory’ boss on Ami and Sheldon’ next step,http://ew.com/tv/2017/05/11/big-bang-theory-finale-proposal-spoilers-season-11/,entertainment-weekly
4,ABC renews ‘Black-ish’ for season 4,ABC renew ‘Black-ish’ for season 4,http://ew.com/tv/2017/05/11/abc-renews-black-ish-season-4/,entertainment-weekly
4,See how ‘Blade Runner 2049’ pays visual homage to Ridley Scott’s original,See how ‘Blade Runner 2049’ pay visual homag to Ridley Scott’s origin,http://ew.com/movies/2017/05/11/blade-runner-2049-original-comparison-video/,entertainment-weekly
4,‘Designated Survivor’ renewed for second season,‘Design Survivor’ renew for second season,http://ew.com/tv/2017/05/11/designated-survivor-renewed-second-season/,entertainment-weekly
4,‘The Catch’ has been canceled,‘The Catch’ ha been cancel,http://ew.com/tv/2017/05/11/the-catch-canceled-abc/,entertainment-weekly
4,NBC orders Mae Whitman and Retta series ‘Good Girls’,The 'Parenthood ' and 'Park and Recreat ' actress return to the network,http://ew.com/tv/2017/05/11/nbc-good-girls-mae-whitman-retta/,entertainment-weekly
4,‘American Crime’ canceled despite Emmy wins,‘American Crime’ cancel despit Emmy win,http://ew.com/tv/2017/05/11/american-crime-canceled/,entertainment-weekly
4,‘Agents of SHIELD’ renewed for season 5,‘Agent of SHIELD’ renew for season 5,http://ew.com/tv/2017/05/11/agents-shield-season-5-renewal/,entertainment-weekly
4,‘Once Upon a Time’ renewed for season 7,‘Onc Upon a Time’ renew for season 7,http://ew.com/tv/2017/05/11/once-upon-time-season-7-renewal/,entertainment-weekly
6,"In a Private Dinner, Trump Demanded Loyalty. Comey Demurred.",Jame B. Comey’ associ say he now believ hi unwilling to pledg person loyalti led Presid Trump to fire him as the F.B.I. director .,https://www.nytimes.com/2017/05/11/us/politics/trump-comey-firing.html,google-news
6,Trump Picks Voter ID Advocate for Election Fraud Panel,"Presid Trump name Kri Kobach , the Kansa secretari of state who ha focus on strict vote law , as vice chairman of a commiss .",https://www.nytimes.com/2017/05/11/us/politics/trump-voter-fraud.html,google-news
