4,"‘Supergirl’ Recap: Cat Grant Returns, Is More Fabulous Than Ever","Rhea want to make Earth great again , and it’ up to Supergirl and friend to resist",http://ew.com/recap/supergirl-season-2-episode-21/,entertainment-weekly
4,'Scorpion' Finale React: Being Stuck on an Island Cramps the Lovebirds' Style,"Buckl up , nerd .",http://ew.com/recap/scorpion-season-3-finale/,entertainment-weekly
4,'Dancing With the Stars' Recap: The Final Four Dance for a Spot in the Finale,The remain four coupl danc for a spot in the final .,http://ew.com/recap/dancing-with-the-stars-season-24-episode-9/,entertainment-weekly
4,'Better Call Saul' Recap: What's in a Name?,What’ a crook lawyer on suspens to do ?,http://ew.com/recap/better-call-saul-season-3-episode-6/,entertainment-weekly
4,"‘Better Call Saul’ co-creator on Jimmy’s transformation, another ‘Breaking Bad’ surprise",Peter Gould break down the last scene of the episod and teas what 's next,http://ew.com/tv/2017/05/15/better-call-saul-creator-jimmy-mcgill-saul-goodman/,entertainment-weekly
4,"‘Quantico’ season 2 finale could work as a series closer, says showrunner",Plu : What would a potenti season 3 look like ?,http://ew.com/tv/2017/05/15/quantico-season-2-finale-postmortem-season-3/,entertainment-weekly
4,'Quantico' Finale Recap: The Shot Heard 'Round the Country,Alex make a bold play to stop the presid .,http://ew.com/recap/quantico-season-2-finale/,entertainment-weekly
4,'The Voice' Recap: Who Should Advance to the Finals?,The top 8 lay it all on the line to earn a spot in the final .,http://ew.com/recap/the-voice-season-12-episode-26/,entertainment-weekly
4,Fox’s fall 2017 schedule: A snap judgment,"A look at 'Ghost , ' 'The Gift , ' 'The Orvil , ' and more",http://ew.com/tv/2017/05/15/fox-fall-2017-schedule-snap-judgment/,entertainment-weekly
4,Man holding human head stabs store clerk; mother found dead,"A man kill hi mother on Mother 's Day at a rural Oregon home , then show up at a groceri store in a nearbi town carri a decapit human head and began stab a checkout clerk ...",http://www.wtvm.com/story/35433930/man-holding-human-head-stabs-store-clerk-mother-found-dead,google-news
15,Fiancee: Aaron Hernandez thought he was going to be freed,Aaron Hernandez 's fiancee Shayanna Jenkins-Hernandez say former tight end thought he wa soon to be releas from prison .,https://www.si.com/nfl/2017/05/12/aaron-hernandez-fiancee-suicide-death-prison,google-news
6,Trump to light White House blue to support police who face ‘unfair defamation and vilification’,The presid accus other politician of fail to support polic .,https://www.washingtonpost.com/news/post-politics/wp/2017/05/15/trump-to-light-white-house-blue-to-support-police-who-face-unfair-defamation-and-vilification/,google-news
3,Russia warns against ‘intimidating’ North Korea after its latest missile launch,The comment were clearli direct at the Unit State .,https://www.washingtonpost.com/news/worldviews/wp/2017/05/15/russia-warns-against-intimidating-north-korea-after-its-latest-missile-launch/,google-news
15,Veteran journalist killed in latest wave of slayings in Mexico state of Sinaloa,"Javier Valdez , who special in cover drug traffick , is sixth journalist to be murder in Mexico in just over two month",http://www.cbsnews.com/news/veteran-journalist-javier-valdez-killed-mexico-state-sinaloa/,google-news
4,Let's Play Injustice 2's Story Mode - Live! - IGN,Injustic 2 is here with an all new stori mode. Join Destin as he complet it live !,http://ca.ign.com/articles/2017/05/16/lets-play-destinys-new-aksis-challenge-live,ign
4,Injustice 2 Review in Progress - IGN,"Faster , deeper action and a wealth of content make thi DC hero fight game feel super .",http://ca.ign.com/articles/2017/05/16/injustice-2-review,ign
4,"Better Call Saul: ""Off Brand"" Review - IGN",A memor cameo and a veri import charact 's first introduct make for anoth great week of Better Call Saul .,http://ca.ign.com/articles/2017/05/16/better-call-saul-off-brand-review,ign
13,Did Donald Trump brief the Russians?,Anoth scandal in the Oval Office—and it’ a big one,http://www.economist.com/blogs/democracyinamerica/2017/05/oops,the-economist
13,Why ESPN is losing subscribers,"As media habit shift toward onlin stream , sport is suffer with the rest of tradit TV",http://www.economist.com/blogs/economist-explains/2017/05/economist-explains-12,the-economist
3,Clues point to possible North Korean involvement in massive cyberattack,Inconclus research show that the ransomwar that disrupt more than 150 countri share some code with a tool from a hacker group possibl link to Pyongyang .,https://www.washingtonpost.com/world/global-markets-shrug-off-fears-after-massive-cyberattack/2017/05/15/16265198-3958-11e7-9e48-c4f199710b69_story.html,the-washington-post
4,Allergies will be even more miserable in the future — thanks to global warming,Yay,https://www.theverge.com/2017/4/10/15203522/allergies-hay-fever-seasonal-spring-pollen-global-warming-climate-change,the-verge
6,Opinion | When the World Is Led by a Child,Report that Presid Trump betray an intellig sourc reveal the danger of an immatur man .,https://www.nytimes.com/2017/05/15/opinion/trump-classified-data.html,the-new-york-times
6,Strict North Carolina Voter ID Law Thwarted After Supreme Court Rejects Case,The move leav in place a lower-court rule that struck down key part of the law as an unconstitut effort to target African-American .,https://www.nytimes.com/2017/05/15/us/politics/voter-id-laws-supreme-court-north-carolina.html,the-new-york-times
7,Rich List 2017: No Brexit 'chilling effect' on wealth of super-rich,"The Hinduja brother top the Sunday Time Rich List , with a £3.2bn boost to their fortun .",http://www.bbc.co.uk/news/uk-39830087,bbc-news
7,Prince Edward says 'the show goes on' as the Duke of Edinburgh retires,The Earl of Wessex becom first royal to speak about Princ Philip 's decis to end public duti .,http://www.bbc.co.uk/news/uk-39831071,bbc-news
7,Seamus Ruddy's family have 'mixed emotions' after human remains find,Famili of Disappear victim Seamu Ruddi welcom bittersweet news that remain have been found .,http://www.bbc.co.uk/news/uk-northern-ireland-39830815,bbc-news
5,"At RT, News Breaks You",U.S. intellig offici have accus the Kremlin-fund network of help swing the elect to Trump .,https://www.bloomberg.com/features/2017-rt-media,bloomberg
4,What Should Selena Gomez And The Weeknd's Couple Name Be?,Brangelina. Bennifer. Seleeknd ?,https://www.buzzfeed.com/whitneyjefferson/seleeknd-or-wekeena,buzzfeed
17,Teens Are Sharing Their Prom Fails From This Year And They're Hilariously Embarrassing,"'I took Sebastian , my blow-up doll , to prom . '",https://www.buzzfeed.com/ryanschocket2/teens-are-the-most,buzzfeed
17,44 Tweets For Women By Women That Are Just Really Fucking Funny,'Oh my ... yet anoth gentleman caller ha sent me hi peni portrait ... ',https://www.buzzfeed.com/erinchack/we-revolt-at-dawn,buzzfeed
17,17 Celebrity Tweets You Missed This Week,"Chrissi Teigen borrow John Legend 's mouth guard , Zac Efron show off hi ab , and more !",https://www.buzzfeed.com/kristinharris/celebrity-tweets-you-missed-this-week-5-5,buzzfeed
14,Here's What Canadians Are Buying On Amazon This Week,"Thi week : Organ coffe , cute passport holder , and pool inflat !",https://www.buzzfeed.com/sarahaspler/awesome-products-canadians-are-buying-on-amazon,buzzfeed
17,"Yes, It Is Possible To Get Pregnant With An IUD",Let 's talk about what realli happen when IUD fail .,https://www.buzzfeed.com/carolinekee/you-still-can-get-pregnant-with-an-iud,buzzfeed
17,14 Pictures Of People Being 100% Right,A remind that good peopl do still exist .,https://www.buzzfeed.com/jamiejones/people-who-are-very-clearly-right,buzzfeed
17,These Trans Women Were Asked To Show Their Passports To Enter A Female Gaming Tournament,'No male are allowed. Pleas take care fake your gender can be [ penalis ] . ',https://www.buzzfeed.com/lanesainty/trans-women-barred-from-gaming-tournament,buzzfeed
4,"Just When I Thought 'Toy Story 3' Couldn't Get Any Sadder, I Noticed This Shit","Damnit , Pixar , with the waterwork .",https://www.buzzfeed.com/balorusso/this-one-small-detail-in-toy-story-3-makes-it-even-more-of,buzzfeed
17,20 Pictures Carrie Underwood Prolly Wishes She Could Delete From The Internet,2005 ... a time for FASHION .,https://www.buzzfeed.com/mjs538/i-blame-ryan-seacrest,buzzfeed
7,82 Chibok schoolgirls released in Nigeria,"Eighty-two Chibok schoolgirl have been releas in Nigeria after success negoti between Boko Haram and the govern , a govern offici said .",http://www.cnn.com/2017/05/06/africa/chibok-girls-released/index.html,cnn
7,Chibok parents pray for missing girls three years on,"It 's been three year sinc Boko Haram milit raid a board school in Chibok , Nigeria , and abduct 276 girls. Some of them have been found , but parent of the girl who are still miss are pray their daughter will one day return home .",http://www.cnn.com/2017/04/14/africa/chibok-girls-three-years-on/index.html,cnn
9,Hats off to the Kentucky Derby's colorful revelers,"See the fashion , loud and color hat at the 143rd run of the Kentucki Derbi .",http://www.cnn.com/2017/05/06/style/gallery/kentucky-derby-hats-2017/index.html,cnn
9,Mint julep: The history of the Derby's official drink,"Dure the 143rd Kentucki Derbi , 320 bartend will serv up approxim 127,000 mint juleps. Thi is that refresh cocktail 's origin stori .",http://www.cnn.com/2017/05/05/foodanddrink/cocktail-history-mint-julep-kentucky-derby/index.html,cnn
13,"Kushner family in Beijing: 'Invest $500,000 and immigrate' to US","The Kushner famili pitch wealthi Chines businesspeopl Saturday , hope to lure them into invest in their real estat by promis it could land them an American passport .",http://money.cnn.com/2017/05/06/news/jared-kushner-nicole-family-event/index.html,cnn
16,FDA approves new treatment for ALS,"The Food and Drug Administr ha approv a new drug for the treatment of AL , or Lou Gehrig 's disease. Radicava , or edaravon , is a product of MT Pharma .",http://www.cnn.com/2017/05/06/health/new-als-drug/index.html,cnn
10,Let's hope this isn't Amazon's touchscreen Echo,Is thi Amazon 's touchscreen Echo ?,https://www.engadget.com/2017/05/05/amazon-touchscreen-echo-leak/,engadget
6,French candidate hacked just before presidential election,Stop us if you 've heard thi one befor : hacker have allegedli releas email from a presidenti candid 's campaign .,https://www.engadget.com/2017/05/05/france-macron-hacking-silent-emleaks/,engadget
10,The Morning After: Weekend Edition,The one where the thing is happen again .,https://www.engadget.com/2017/05/06/the-morning-after-weekend-edition/,engadget
10,The enduring myth of the hacker boy-band,"Appar , not all 1337 hax0r are consid equal .",https://www.engadget.com/2017/05/05/the-enduring-myth-of-the-hacker-boy-band/,engadget
9,The Best and Brightest Hats from This Year's Kentucky Derby,Hat’ entertain !,http://ew.com/events/the-best-and-brightest-hats-from-this-years-kentucky-derby,entertainment-weekly
9,Kentucky Derby draws celebs to the racetrack,Kentucki Derbi draw celeb to the racetrack,http://ew.com/news/2017/05/06/kentucky-derby-draws-celebs-to-the-racetrack/,entertainment-weekly
9,Tracy Morgan attends Kentucky Derby as part of post-accident bucket list,< p class= '' p1 '' > < span class= '' s1 '' > 'I want to do all the thing I want to do now that I surviv that accident’ < /span > < /p >,http://people.com/celebrity/tracy-morgan-kentucky-derby-bucket-list/,entertainment-weekly
15,'Why do you want to kill my daughter?': House Republicans face voters angry over health care bill,Some Republican member of Congress who vote in favor of repeal and replac Obamacar are face enrag voter at hometown forum thi week .,http://abcnews.go.com/Politics/house-republicans-face-voters-home-districts-angry-health/story?id=47247115,google-news
4,Kurt Russell Didn't Use CGI for Guardians of the Galaxy Vol. 2 Flashback - IGN Video,Kurt Russel explain what went into realist de-ag him for the open sequenc of Guardian of the Galaxi Vol. 2 .,http://ca.ign.com/videos/2017/05/06/kurt-russell-didnt-use-cgi-for-guardians-of-the-galaxy-vol-2-flashback,ign
4,DLC - The Legend of Zelda: Breath of the Wild Wiki Guide - IGN,"DLC - The Legend of Zelda : Breath of the Wild : The Legend of Zelda : Breath of the Wild is the first Zelda game to includ download content ( DLC ) . The DLC will come in three separ pack , and ...",http://ca.ign.com/wikis/the-legend-of-zelda-breath-of-the-wild/DLC,ign
6,Analysis | Democrats’ two biggest opponents ahead of 2018 may be time and themselves,"Democrat say Republican will “pay the price” in the midterm for the health-car bill , but their intern divis stand in the way of a strong campaign .",https://www.washingtonpost.com/powerpost/democrats-two-biggest-opponents-ahead-of-2018-may-be-time-and-themselves/2017/05/06/49efdce4-3280-11e7-9534-00e4656c22aa_story.html,the-washington-post
6,‘Does it pass the Jimmy Kimmel test?’ asks GOP senator who authored proposal to replace Obamacare,Sen. Bill Cassidi ( R-La. ) co-author a propos that he say would keep protect on peopl with preexist condit .,https://www.washingtonpost.com/news/the-fix/wp/2017/05/06/does-it-pass-the-jimmy-kimmel-test-asks-senator-who-authored-proposal-to-replace-obamacare/,the-washington-post
4,"New trailers: The Dark Tower, Marvel’s The Defenders, House of Cards, and more","The Wachowski & # 39 ; strang , celebratori , and globe-span seri Sense8 return for a second season on Netflix thi week , so my colleagu Tasha Robinson sat down to talk about the show with actor ...",https://www.theverge.com/2017/5/6/15563096/new-trailers-dark-tower-marvel-the-defenders-house-of-cards-watch,the-verge
10,New Nintendo 2DS XL hands-on: this is the 3DS that always should have been,"The New Nintendo 2D XL came as a surpris to the tech world. In the lead-up to the releas of the Switch , Nintendo said it new portabl hardwar and it old handheld would coexist. But as the ...",https://www.theverge.com/2017/5/5/15549048/new-nintendo-2ds-xl-video-photos-preivew-vs-3ds-xl,the-verge
10,Watch this dancing Pikachu get dragged mercilessly offstage for deflating mid-performance,LET HIM DANC .,https://www.theverge.com/tldr/2017/5/5/15556164/pokemon-deflating-pikachu-dance-video-watch,the-verge
10,"Inundated by spam Facebook accounts, USA Today has asked the FBI to investigate",Nearli a third of it Facebook follow were purg last month,https://www.theverge.com/2017/5/6/15569156/usa-today-fbi-gannett-company-facebook-social-media-spam-fake-followers,the-verge
10,Emails leaked in ‘massive hacking attack’ on French presidential campaign,Eeri similar to Clinton campaign hack,https://www.theverge.com/2017/5/5/15564532/macron-email-leak-russia-hacking-campaign-4chan,the-verge
10,This minimalist cell phone is designed to be as basic as possible,"No text , e-mail , or anyth els",https://www.theverge.com/2017/5/6/15569624/the-light-phone-cell-minimal-gadget,the-verge
10,This spherical chess board uses magnets to change up the game,A whole new spin on the game,https://www.theverge.com/2017/5/6/15568216/wooden-globe-chess-board-magnets-maker-ben-myers,the-verge
15,Student Arrested After Crawling Into a Duct to Steal an Exam,"The plot , carri out in the wee hour of Wednesday at the Univers of Kentucki , wa foil becaus the instructor wa work late , an offici said .",https://www.nytimes.com/2017/05/04/us/university-of-kentucky-stolen-test.html,the-new-york-times
7,"Automation poses a high risk to 1.2m Scottish jobs, report says",A think tank say 46 % of job in Scotland are at `` high risk '' of autom in the period up to 2030 .,http://www.bbc.co.uk/news/uk-scotland-39830113,bbc-news
9,Watch: Match of the Day,Watch BBC One live on BBC iPlay .,http://www.bbc.co.uk/iplayer/live/bbcone,bbc-sport
4,17 Unsettling Pixar Moments That Freaked You The Fuck Out,"Too far , Pixar. Too far .",https://www.buzzfeed.com/spenceralthouse/unsettling-pixar-moments,buzzfeed
17,17 Fucked-Up First Date Stories That’ll Make You Want To Be Single,Omfg .,https://www.buzzfeed.com/annakopsky/weird-date-stories-thatll-make-you-want-to-stay,buzzfeed
17,Go Camping And We'll Reveal Who You'll Sleep With Next,A-camp we will go !,https://www.buzzfeed.com/nataliebrown/go-on-a-camping-trip-and-well-reveal-who-youll-sleep-with,buzzfeed
17,17 Photos That Prove Kids Are Just Tiny Jerks,"So hilari , yet so mean .",https://www.buzzfeed.com/andyneuenschwander/17-photos-that-prove-kids-are-kinda-just-short-assh,buzzfeed
17,29 Jokes From Arrested Development That Will Never Not Be Funny,"'He lost hi left hand , so he 's go to be all right . '",https://www.buzzfeed.com/lyapalater/jokes-from-arrested-development-that-will-never-not-be,buzzfeed
17,Literally Just A Bunch Of Celebrity Outfits From 2007 That Will Make You Say 'Girl WHAT Were You Thinking?!',Time have chang .,https://www.buzzfeed.com/samstryker/insane-2007-outfits,buzzfeed
17,I Tried 10 Insanely Popular Pinterest Beauty Hacks IRL,Some deliv — and other ( definit ) did n't .,https://www.buzzfeed.com/emilyshwake/pinterest-beauty-hacks,buzzfeed
17,15 Photos All Feminists Who Don't Have Time For The Patriarchy Will Understand,"'Idk I think femin should be call someth differ , like common sens or someth . '",https://www.buzzfeed.com/erinlarosa/photos-all-people-who-dont-have-time-for-the-patriarchy,buzzfeed
13,'SNL' asks 'Where in the World is Kellyanne Conway?',"Move over Carmen Sandiego , `` Saturday Night Live '' is look for Kellyann Conway .",http://money.cnn.com/2017/05/07/media/saturday-night-live-where-is-kellyanne-conway/index.html,cnn
6,Is Colbert's Tump joke a firing offense?,"An onlin campaign aim to have Stephen Colbert fire for hi Presid Trump jokes. CNN comment Judi Gold , Paul Callan and Danni Cevallo weigh in on what should happen next:",http://www.cnn.com/2017/05/06/opinions/stephen-colbert-gold-callan-cevallos/index.html,cnn
5,"Debra Messing, ‘Daily Show’ among winners at GLAAD Media Awards",The 'Will & Grace ' star wa honor with the Excel in Media Award,http://ew.com/news/2017/05/06/debra-messing-daily-show-glaad-media-awards/,entertainment-weekly
4,Things to Do First - The Division Wiki Guide - IGN,Thing to Do First - The Divis : Thi page cover import step to take when first start out as an Agent in Tom Clanci 's The Division. It will cover specif mission to complet ...,http://ca.ign.com/wikis/the-division/Things_to_Do_First,ign
4,Alien: Covenant review: a terrifying return to horror that doesn’t quite click,Bloodier than you can believ,https://www.theverge.com/2017/5/6/15570852/alien-covenant-review-ridley-scott,the-verge
5,"Judy Woodruff, the Woman of the Hour","Though still mourn her “PB NewsHour” co-anchor , Gwen Ifil , Ms. Woodruff continu to be a pioneer role model in journal .",https://www.nytimes.com/2017/05/06/style/judy-woodruff-pbs-newshour.html,the-new-york-times
7,Major search under way for speedboat off Galloway coast,"Two helicopt , coastguard team and lifeboat are involv in the oper to find the miss men .",http://www.bbc.co.uk/news/uk-scotland-south-scotland-39835436,bbc-news
7,UK tourists hit by booking scams up by nearly a fifth,"The most common scam relat to plane ticket , onlin accommod book and timeshar sale .",http://www.bbc.co.uk/news/uk-39835874,bbc-news
7,Who is Marine Le Pen?,"Ride a global wave of popul , Franc 's far-right Nation Front leader , Marin Le Pen , is convinc her time ha final come .",http://www.cnn.com/2017/02/01/europe/marine-le-pen-profile/index.html,cnn
6,"Democrats, don't get too giddy about 2018","Julian Zeliz write that histor , the parti in control of the White Hous suffer a big defeat in the midterm elect , but mani factor could get in the way of a Democrat sweep",http://www.cnn.com/2017/05/07/opinions/democrats-dont-get-giddy-about-2018-opinion-zelizer/index.html,cnn
7,US citizen detained in North Korea,"North Korea ha detain a US citizen on suspicion of act against the Pyongyang regim , the state-run Korean Central News Agenc report Sunday .",http://www.cnn.com/2017/05/07/asia/north-korea-american-detained/index.html,cnn
15,New details emerge in horrific Penn State fraternity death,"Eighteen Pennsylvania State Univers student and a former fratern at the school are face charg in connect with the death of Beta Theta Pi pledg Timothi Piazza , who die after fall down stair at the frat hous dure a pledg ceremoni , a prosecutor said thi morn , as she releas",https://www.yahoo.com/gma/penn-state-fraternity-18-students-charged-connection-pledges-160537791--abc-news-topstories.html,google-news
6,Trump tries to pressure Senate Republicans on health care,"Presid Donald Trump urg Senat Republican on Sunday to “not let the American peopl down , ” as the contenti debat over overhaul the U.S. health care system shift to Congress’ upper chamber , where a vote is potenti week , if not month , away .",https://www.washingtonpost.com/national/health-science/hhs-secy-1t-proposed-medicaid-cuts-gives-states-freedom/2017/05/07/4ecfbb76-332f-11e7-ab03-aa29f656f13e_story.html,google-news
4,Cheats and Secrets - Prey Wiki Guide - IGN,Cheat and Secret - Prey : Thi page document all known Cheat and Secret found in Prey. Know of one that we do n't ? Add it below by hit the EDIT button ! If you 're lacki ...,http://ca.ign.com/wikis/prey-2017/Cheats_and_Secrets,ign
4,Legend of Zelda: Breath of the Wild DLC Details - IGN Daily Fix - IGN Video,"Breath of the Wild 's first DLC pack detail , get your first look at Xbox Scorpio 's dev , and thi week 's biggest stori .",http://ca.ign.com/videos/2017/05/07/legend-of-zelda-breath-of-the-wild-dlc-details-ign-daily-fix,ign
6,SNL ridicules Kellyanne Conway in a remarkably short sketch,`` Where in the World Is Kellyann Conway ? '' is n't the game show you rememb .,https://www.washingtonpost.com/news/the-fix/wp/2017/05/07/snl-ridicules-kellyanne-conway-in-a-remarkably-short-sketch/,the-washington-post
9,"Thunder Snow, the horse that refused to run the Kentucky Derby, is doing fine",The Irish-br colt is uninjur follow one of the shakiest start in Derbi histori .,https://www.washingtonpost.com/news/early-lead/wp/2017/05/07/thunder-snow-the-horse-that-refused-to-run-the-kentucky-derby-is-doing-fine/,the-washington-post
5,Read a creepy excerpt from Stephen Graham Jones’ upcoming novella,Map the Interior is out on June 20th,https://www.theverge.com/2017/5/7/15455648/stephen-graham-jone-novella-mapping-the-interior-excerpt,the-verge
5,"Why are some of sci-fi’s beloved female leads deadly, beautiful, and hopelessly naive?",I prefer my women as equal,https://www.theverge.com/2017/5/7/15556516/fifth-element-tron-born-sexy-yesterday-trope,the-verge
10,"Families of the San Bernardino terrorist attack victims have filed a lawsuit against Facebook, Google and Twitter",They contend that the tech industri and it practic have been “instrument to the rise of ISIS.”,https://www.recode.net/2017/5/7/15572560/families-san-bernardino-terrorist-attack-lawsuit-facebook-google-twitter-isis,the-verge
7,Liverpool dog attack: Two-year-old girl injured in garden,The two-year-old girl is in hospit after be attack by a number of dog in a back garden .,http://www.bbc.co.uk/news/uk-england-merseyside-39840524,bbc-news
7,Two bodies recovered after search for speedboat,A search wa launch for two men miss sinc Saturday after take a trip from Dumfri and Galloway .,http://www.bbc.co.uk/news/uk-scotland-south-scotland-39838036,bbc-news
7,More than half of UK vapers 'have given up smoking',"More than a third of smoker have still never tri `` safer '' e-cigarett , health chariti say .",http://www.bbc.co.uk/news/health-39823325,bbc-news
16,PTSD: 'I thought it was a man thing',"Thirteen percent of young women show symptom associ with post-traumat stress disord , accord to an NH report. Two women who 've experienc it share their stori .",http://www.bbc.co.uk/news/av/magazine-39811540/ptsd-i-thought-it-was-a-man-thing,bbc-news
6,General election 2017: NHS pay cap 'must be lifted',NH boss urg the next govern to look at lift the pay cap on health staff .,http://www.bbc.co.uk/news/health-39838752,bbc-news
3,Two Black Queer Characters Won 'Best Kiss' And People Couldn't Be Happier,THI IS IMPORT !,https://www.buzzfeed.com/jemimaskelley/two-black-queer-characters-won-best-kiss-and-people-couldnt,buzzfeed
4,Emma Watson Receives First Gender-Neutral Acting Award In Awards Show History,Her speech about it will give you all the feel !,https://www.buzzfeed.com/jenniferabidor/emma-watson-receives-first-gender-neutral-acting-award-in,buzzfeed
17,Where Do You Take The First Bite On These Foods?,Chew on thi .,https://www.buzzfeed.com/sarahaspler/where-do-you-take-the-first-bite-on-these-foods,buzzfeed
17,18 Hilariously Embarrassing Masturbation Horror Stories That'll Leave You Cringing,A remind that you should alway make sure that your door is lock .,https://www.buzzfeed.com/briangalindo/18-hilariously-embarrassing-masturbation-horror-stories,buzzfeed
17,"If None Of These Pictures Make You Say 'What The Fuck', Nothing Will",I am so confus .,https://www.buzzfeed.com/daves4/wat-wat-wat,buzzfeed
17,Have “The Real Housewives” Peaked?,The franchis ha remain a cultur forc for over a decad by reinvent itself. But ha it swallow it own tale ?,https://www.buzzfeed.com/pdominguez/has-the-real-housewives-peaked,buzzfeed
17,19 Toys You're Still Mad That You Never Got As A Kid,"And honestli , still want ! ! !",https://www.buzzfeed.com/briangalindo/19-toys-that-everyone-really-wanted-to-get-as-a-kid,buzzfeed
17,21 Very Good Puns That We Should All Just Start Using,What idiot came up with all these name ?,https://www.buzzfeed.com/awesomer/what-idiot-called-it,buzzfeed
