6,Trump Seeks Credit for America's Debt Reduction,Presid Donald Trump ask on Twitter whi the media hasn’t report that the nation debt ha drop sinc hi inaugur .,bloomberg
10,Facebook's Clones Attack Snapchat,"Facebook 's approach to Snapchat ha been : if you ca n't buy it , copi it .",bloomberg
6,Trump Says He Won't Attend White House Correspondents Dinner,"Presid Donald Trump said he won’t attend thi year’ White Hous Correspond Associ Dinner on April 29 , follow week of attack on news organ that includ call them “the enemi of the American people.”",bloomberg
5,The Oscars Are Looking More Diverse This Year,Thi year’ Oscar nomine includ seven peopl of color in the best and support act categori .,bloomberg
13,The Next Financial Crisis Might Be in Your Driveway,"With late payment on the rise , a dealership upsel begin to look danger .",bloomberg
6,"White House Denies Briefing Access to New York Times, Politico, CNN","White Hous press secretari Sean Spicer exclud sever major news outlet , includ the New York Time and CNN , from an untelevis media brief on Friday , hour after Presid Donald Trump assail coverag of hi administr .",bloomberg
6,Perez Elected Democratic Chair as Party Seeks New Direction,"Former Labor Secretari Tom Perez wa elect chairman of the Democrat Nation Committe on Saturday , as the parti struggl to set a new direct after Hillari Clinton’ Novemb loss to Donald Trump .",bloomberg
6,Trump declines to attend White House correspondents' dinner,"Presid Donald Trump ha announc that he will not attend thi year 's White Hous Correspond ' Dinner , a move that come amid increasingli hostil relat between the media and the White Hous .",cnn
6,"Jen Psaki: Without free press, democracy dies",The former Obama White Hous commun director say the Trump administr 's comb approach to the press risk follow the model of Russia .,cnn
6,President Trump starts rally attacking media - CNN Video,"At a campaign-styl ralli in Melbourn , Florida , Presid Trump start out by attack the media say he want to speak to the crowd without the filter of the `` fake news . ''",cnn
6,Republican lawmaker: Russia investigation needs special prosecutor,"A Republican lawmak who support Donald Trump in the 2016 presidenti elect said a special prosecutor should investig report commun between the Trump campaign and Russian known to US intellig , not Attorney Gener Jeff Session .",cnn
6,National security adviser: Term 'radical Islamic terrorism' isn't helpful,"New nation secur advis H.R. McMaster is alreadi set a strikingli differ tone than hi oust predecessor , Michael Flynn , and Presid Donald Trump , say the term `` radic Islam terror '' is n't help for US goal .",cnn
6,Trump's call for US nuclear supremacy raises questions,Presid Donald Trump would like the US to be `` at the top of the pack '' when it come to have nuclear weapon,cnn
6,Trump: US will be top of the pack with nukes - CNN Video,Presid Donald Trump told Reuter that the US should be lead the world in nuclear weapons. The statement left non-prolifer expert puzzl and concern .,cnn
6,Trump is costing the US friends,"While Presid Donald Trump wa busi ignor the realiti of hi low approv rate by bath in the embrac of an ador crowd last weekend , hi foreign polici challeng were stack up .",cnn
15,Truck rams crowd during Mardi Gras parade,"One man is in custodi after a pickup truck ram a crowd at a New Orlean Mardi Gra parad , polic said. At least 21 peopl were hurt .",cnn
6,Perez wins DNC chairmanship,Democrat chose a new chair to lead their batter parti as it tri to channel it base 's anti-Donald Trump energi into an elector rebound .,cnn
10,This baby monitor uses radar to detect infant breathing patterns,"I’ll be honest , hear about what Raybabi doe made me happi I don’t have kids. The mere thought of need a devic to monitor a child’ breathing..",techcrunch
10,Uber employees are chatting with each other about Uber’s leadership on anonymous workplace app Blind,Uber employe have flock to an anonym workplac app call Blind as a sort of catharsi sinc ex-Ub engin Susan Fowler Rigetti post about being..,techcrunch
10,Elon Musk addresses working condition claims in Tesla staff-wide email,"Tesla CEO Elon Musk ha share the result of hi own investig into factori work condit at the carmak , follow accus by employe and..",techcrunch
10,"Weekly Roundup: Uber responds to sexual harassment claim, NASA discovers Earth-like planets","Tech news wa heavi thi week. Uber is face a sexual harass claim as well as a lawsuit from Googl , NASA discov planet with what could prove to be..",techcrunch
10,"While tech giants hire, startups fret — Has Brexit Britain become La La Land?","If you’v read the latest headlin about Britain’ tech industri , you’d think the countri hadn’t been rock by the greatest polit and economic..",techcrunch
6,"Don't give up, Jeremy Corbyn urges Labour",Leader say the parti must `` remain unit '' follow it by-elect loss to the Conserv .,bbc-news
5,"Bill Paxton, actor known for Aliens and Titanic, dies aged 61","Actor Bill Paxton , known for role in Alien and Titan , ha die age 61 , hi famili tell US media",bbc-news
3,Germany hate crime: Nearly 10 attacks a day on migrants in 2016,"More than 3,500 attack were carri out on migrant and asylum shelter in Germani last year .",bbc-news
15,"Girl, five, died of asthma attack after GP turned her away","Five-year-old Ellie-May Clark , who wa minut late for an appoint , die of an asthma attack .",bbc-news
10,Nokia 3310 mobile phone resurrected at MWC 2017,An icon Nokia phone is revamp with ad batteri life and new featur alongsid sever Nokia-brand Android model .,bbc-news
9,Six Nations 2017: England 36-15 Italy,England overcom a stern challeng from Itali to remain unbeaten in thi year 's Six Nation and stretch their win run to 17 match .,bbc-news
6,Disability benefits: PIPs should be for 'really disabled',A key Theresa May aid is be criticis over hi comment defend chang to the PIP system .,bbc-news
7,Former Ernie building demolished in Blackpool,"The former home of the origin Erni machin , which gener win Premium Bond number , is demolish .",bbc-news
15,Man critical after car hits five people in Bellingham,One man is critic and four other injur after a Merced crash into them in south-east London .,bbc-news
9,EFL Cup final: Man Utd 2-2 Saints - Gabbiadini leads Saints comeback,Listen to BBC Radio 5 live commentari and follow updat of the EFL Cup final at Wembley .,bbc-sport
9,Tottenham Hotspur 4-0 Stoke City,Harri Kane score hi third hat-trick in nine game as Tottenham react to their European exit by hammer Stoke to go second in the leagu .,bbc-sport
9,FA People’s Cup: First round - Day three,"Follow live text commentari , match action and the best from social media on day three of the 2017 FA People’ Cup first round .",bbc-sport
9, Bobsleigh and Skeleton World Champs highlights,Watch BBC Two live on BBC iPlay .,bbc-sport
9,Formula 1: Red Bull launches new RB13 car for 2017,Red Bull unveil the car mani expect to be the closest challeng to world champion Merced in 2017 - the RB13,bbc-sport
9,Welsh rugby international Elli Norkett dies in A4109 crash - BBC News,A woman who die in a crash in Neath Port Talbot is name as Wale rugbi intern Elli Norkett .,bbc-sport
9,Atletico Madrid 1-2 Barcelona,Lionel Messi score a late winner as Barcelona beat Atletico Madrid to move top of La Liga .,bbc-sport
6,Trump's Great Chance to Tell Us What He Really Wants,There 's a lot of confus to clear up when the presid address Congress Tuesday night .,bloomberg
10,Google Assistant Goes Beyond the Pixel to Take on Apple's Siri,"Googl is bring it voic assist to the latest Android phone , start with a closer partnership with LG Electron .",bloomberg
13,"For Warren Buffett, America’s Best Days Always Lie Ahead","Everi new gener of babi is the “luckiest crop , ” and thing are never as bad as they seem .",bloomberg
6,"Trump's Budget Won’t Touch Entitlement Programs, Mnuchin Says","Treasuri Secretari Steven Mnuchin said Presid Donald Trump’ upcom budget won’t touch entitl program such as Social Secur or Medicar , and will instead focu on way to produc long-term econom growth by slash tax .",bloomberg
13,Goldman Sachs Warns U.S. Stocks Are Now Reaching Peak Optimism,Peak optim is fast approach .,bloomberg
13,Why La La Land Worked Better Than Anyone Dreamed,"How valu invest , mix with a contrarian streak , help Lion Gate beat the blockbust model .",bloomberg
13,"Deutsche Bank Cuts 2016 Bonus Pool by Almost 80%, FAS Reports","Deutsch Bank AG cut it bonu pool for 2016 by almost 80 percent , Frankfurt Allgemein Sonntagszeitung report , a figur unmatch in the bank’ recent histori as it tri to counteract the impact of low interest rate and legal expens .",bloomberg
13,These Are All the Ways a Saudi Aramco IPO Could Impact Markets,"The exact dollar valu of Saudi Aramco may be up for debat , but th list of the world’ biggest compani will be priceless for the kingdom’ market .",bloomberg
5,"Bill Paxton, actor in 'Twister' and 'Aliens,' dies at 61","Actor Bill Paxton , whose extens career includ film such as `` Twister , '' `` Alien '' and `` Titan , '' ha die , a repres for hi famili said in a statement. He wa 61 .",cnn
5,Bill Paxton's most memorable roles - CNN Video,"Actor Bill Paxton , whose extens career includ film such as `` The Termin , '' `` Alien '' and `` Titan , '' ha die at age 61 , a repres for hi famili said in a statement .",cnn
16,People we've lost in 2017,A look back at notabl peopl who have die in 2017 .,cnn
6,Perez: Need to investigate whether presidential election was 'rigged',New Democrat Nation Committe Chairman Tom Perez is join call for an independ investig into report contact between Presid Donald Trump 's campaign and Russian known to US intellig .,cnn
6,Christie to lawmakers avoiding town halls: Go do your job,New Jersey Gov. Chri Christi say Republican lawmak should hold town hall even if that mean confront hundr of angri progress constitu .,cnn
15,8-year-old fatally shot after crash - CNN Video,Polic are search for the peopl who shot and kill 8-year-old De'Mare Adkin who wa travel with her mother in Houston .,cnn
6,Sanders: Not 'impressed' with DNC election process,"Berni Sander said on `` State of the Union '' Sunday that he doe n't believ hi candid for Democrat Nation Committe chairman , Minnesota Rep. Keith Ellison , wa defeat Saturday becaus the elect wa rig , but the system could use some retool .",cnn
6,Perez: Trump worst president in US history - CNN Video,"The Democrat Nation Committe elect Tom Perez as it new chairman , vote for the former labor secretari over Minnesota Rep. Keith Ellison in a 235-200 vote .",cnn
10,"LG unveils the G6, swapping modularity for new screen dimensions and waterproofing","The modular G5 wa a novel devic , but novelti alon doesn’t sell phones. So LG went back to the draw board for it followup , and the result is , on a..",techcrunch
10,Live from Samsung’s 2017 MWC press conference,"A veri happi Mobil World Congress to you and yours. The world’ largest smartphon show is still a coupl of days from it offici kick off , but..",techcrunch
10,Huawei’s shiny P10 flagships come in (almost) all the colors of the rainbow,"If you 're bore of the same old monotone/metal smartphon color choic , Chines mobil maker Huawei ha been think a littl differ for it just..",techcrunch
10,LG proves that taller screens are the future of smartphones,"Bigger screen don’t cut it anymore. Now , we need taller screens. I’v been play with the LG G6 for the past 24 hours. In mani way , it is just another..",techcrunch
10,The Age of the Giant Battery Is Almost Upon Us,The idea that giant batteri may someday revolution electr grid ha long enthral clean-pow advoc and environmentalists. Now it’ attract banker with the money to make it happen .,bloomberg
5,Bill Paxton: Filmmaking always my dream (2005) - CNN Video,Actor Bill Paxton tell Larri King that be a filmmak wa alway hi dream,cnn
5,Ben Stein: Media doing to Trump what it did to Nixon - CNN Video,"While defend Presid Trump 's decis to skip the White Hous Correspond Dinner , Ben Stein said that the media is `` tri to do to Trump what they did to Nixon '' dure the Waterg scandal .",cnn
5,Oscars mistake: Moonlight wins best picture after announcement mix-up,Moonlight win best pictur at the Oscar - after Fay Dunaway initi say La La Land won .,bbc-news
5,The moment producers realised they hadn't won,The moment when La La Land produc realis Moonlight had won the Oscar for best pictur,bbc-news
5,In pictures: Oscars glitz and glamour on the red carpet,"Star includ Emma Stone , Viola Davi and Dev Patel walk the red carpet at the 89th Academi Award .",bbc-news
5,Oscars winners 2017: The full list,All the winner at thi year 's Academi Award .,bbc-news
5,"Oscar speech highlights: Moonlight, La La Land and more","Winner of the 89th Academi Award , includ Viola Davi , Emma Stone , Mahershala Ali and Casey Affleck .",bbc-news
5,Nine epic fails from awards ceremonies and TV contests,"La La Land is wrongli given the best pictur Oscar , but it is not the first jaw-drop award fail .",bbc-news
5,Woman deported to Singapore despite 27-year marriage,"Iren Clennel ha been sent back to Singapor , leav behind her husband and son in Britain .",bbc-news
6,Labour MP Gerald Kaufman dies at 86,Sir Gerald had been an MP sinc 1970 and becam the oldest serv member of the Common in 2015 .,bbc-news
15,Child sex abuse inquiry public hearings to start,The first public session will focu on British children sent to Australia between 1945 and 1974 .,bbc-news
13,Energy bills: customer switching hits six-year high,"Consum are now more like to seek out better deal , but the regul warn mani still lose out .",bbc-news
9,EFL Cup final: Does Manchester United win make season a success?,"Jose Mourinho and Zlatan Ibrahimov 's partnership hint at more success for Manchest Unit , write Phil McNulti .",bbc-sport
9,Six Nations 2017: Italy's tactics test England - and Eddie Jones' patience - to the limit,"Itali 's tactic at Twickenham test England - and Eddi Jone ' patienc - to the limit , write Tom Fordyc .",bbc-sport
9,F1 testing 2017: Day one,"Follow live text commentari , imag , social media and analysi from the first day of test at Circuit de Catalunya .",bbc-sport
9,"Garth Crooks' team of the week: Ibrahimovic, Gabbiadini, Kane, Fabregas, Kante",Who is the next nearest thing to N'Golo Kant ? Whose presenc at Old Trafford is like that of Roy Kean ? Find out in Garth 's team of the week .,bbc-sport
9,Anthony McGill wins one-frame Coral Shoot Out tournament,Anthoni McGill win the Shoot Out titl in Watford in the first year that the one-fram format ha been count as a rank event .,bbc-sport
9,FA People's Cup 2017 kicks off even bigger and better than ever!,"More than 6,000 team join battl in the first stage of the FA Peopl 's Cup 2017 - here 's our round-up of the weekend 's action , and more ...",bbc-sport
9,Six Nations Remix: England don't know the rules,"An altern look back at the third round of the Six Nation , as England do n't know the rule , Eddi Jone is angri and Rhi Webb is impish .",bbc-sport
9,Andy Murray says he is 'ready to go' for Dubai Tennis Championships,World number one Andi Murray say he is `` readi to go '' at the Dubai Tenni Championship after a bout of shingl .,bbc-sport
6,"Proposed Trump Budget to Hike Defense Spending, Cut EPA","Presid Donald Trump is propos major defens spend increas and big cut to the Environment Protect Agenc , State Depart and other feder agenc in a propos budget to be present soon to Congress , said a person familiar with the plan .",bloomberg
13,Fed Turns to Job Hoppers as 1950s Inflation Guide Shows Its Age,"Adrienn Heintz , an Atlanta market profession , ha discov a reliabl way to earn higher wage , and Feder Reserv economist are take note .",bloomberg
3,China's Spat With Kim Jong Un Shows Difficulty Stopping Him,The rare public spat between China and North Korea illustr the dilemma face Beijing’ leader as they tri to coax Kim Jong Un back to the negoti tabl .,bloomberg
5,Last-Minute `Moonlight' Oscar Win Marks Black Film Milestone,"In an upset made all the more shock by the way it wa announc , “Moonlight” won the Oscar for best pictur , a crown achiev for African-American filmmak after two year of controversi over institut racism in Hollywood .",bloomberg
3,Pound Drops as May Reported to Brace for New Scottish Referendum,The pound fell against all it major peer after The Time report that U.K. Prime Minist Theresa May’ team is prepar for Scotland to potenti call for an independ referendum in March .,bloomberg
13,Buffett Stings Hedge Funds Anew Over Their `Misbegotten' Rewards,Warren Buffett’ sweep endors of index invest is sure to sting the hedge-fund industri and encourag the stamped into asset that passiv track the market .,bloomberg
13,Age of Populism Shakes Pedestal of Central Bank Independence,"As popul grip Europ , the U.S. and elsewher , there are few target as ripe for polit assault as the institut stuf with unelect technocrat wield the power to affect the econom fate of million .",bloomberg
6,Chao Warns Governors: Paying for Big Transport Plans to Be Hard,"The White Hous is work on plan for improv U.S. transport and other key structur , but agre on how to pay for expens new project won’t be easi , Transport Secretari Elain Chao told the nation’ governor .",bloomberg
10,"Samsung Teases Release of Galaxy S8, Shows New Tablets",​Samsung Electron Co. teas it come Galaxi S8 smartphon and releas new tablet target video-gam and profession as the compani seek to regain ground lost after pull it Note 7 from shelv last year .,bloomberg
6,Past CIA Director Brennan Says Russia Probe Must Be Bipartisan,Former CIA Director John Brennan call for congression committe look into the possibl of Russian interfer in the 2016 U.S. presidenti elect to “pursu thi investig with vigor and with the appropri amount of bipartisan support.”,bloomberg
5,Oscars 2017: 'Moonlight' wins Best Picture after some confusion,Oscar 2017 : 'Moonlight ' win Best Pictur after some confus,cnn
5,'Moonlight' wins best picture Oscar after baffling on-stage flub,It 's an Oscar moment that will go down in histori .,cnn
5,Watch: Best Picture mix-up on stage - CNN Video,"Fay Dunaway and Warren Beatti present `` La La Land '' as the winner of the best pictur award , and the celebr began on stage but wa quickli end when one of the `` La La Land '' winner point out that in fact `` Moonlight '' had won the award .",cnn
5,"Oscars mix politics, silliness and shocking twist ending","academi award review Jimmi Kimmel bring silli to Oscar punctuat by polit , silli and a shock twist end",cnn
5,Oscars: The winners list,Oscar winner 2017 list,cnn
5,Oscars 2017: On the red carpet,See photo from the red carpet at the 2017 Academi Award .,cnn
5,Netflix's 'The White Helmets' wins Oscar,"`` The White Helmet , '' a documentari about volunt rescu worker in Syria , took home the Oscar for Best Documentari Short Sunday. It wa the first Academi Award win for Netflix , which distribut the film .",cnn
6,Fallen SEAL's dad slams Trump,"Bill Owen , the father of the Navi SEAL kill in a late-Januari raid in Yemen , level bite critic at the White Hous and call for an investig into hi son 's death in a news stori publish Sunday .",cnn
6,"DHS's Kelly promises softer stance on immigration, travel ban",Homeland Secur Secretari John Kelli said immigr enforc would be limit to crimin and the travel ban wo n't target Muslim .,cnn
6,Navy secretary nominee Philip Bilden withdraws,"Presid Trump 's nomine for secretari of the Navi , Philip Bilden , ha withdrawn hi name from consider , Bilden and Secretari of Defens Jim Matti said Sunday in statement .",cnn
9,Sportsday - Reaction to Man Utd's cup win,"Latest footbal news includ fallout from the EFL Cup final , plu gossip and the best of social media .",bbc-sport
9,Manchester United: Jose Mourinho believes Zlatan Ibrahimovic will stay at club,Manchest Unit manag Jose Mourinho believ striker Zlatan Ibrahimov will stay - but will not `` beg '' him to do so .,bbc-sport
13,Insurance premiums 'set to soar' after compensation changes,Insur say chang to the calcul of compens payment for accid victim are `` crazi '' .,bbc-news
15,IICSA child sex abuse inquiry public hearings under way,A former child migrant break down while talk about British children abus oversea .,bbc-news
6,Trump lays out hike in military spending,Donald Trump propos a $ 54bn ( £43bn ) militari spend increas - a rise of about 10 % on 2016 .,bbc-news
5,Oscars 2017: Moonlight wins best picture after announcement mix-up,Barri Jenkin ' Moonlight win best pictur at the Oscar after an error involv wrong envelop .,bbc-news
3,France election: Why people are voting for Marine Le Pen,We go behind the scene at a Nation Front ralli in Nant .,bbc-news
3,Sir John Major attacks 'unreal' Brexit vision,The former Tori prime minist also say the cost of leav the EU will be `` unpalat '' .,bbc-news
5,Game of Thrones actor Neil Fingleton dies,"Neil Fingleton , who at 7ft 7in wa Britain 's tallest man , wa a basketbal player befor he becam an actor .",bbc-news
6,John McDonnell says 'soft coup' launched against Corbyn,Shadow Chancellor John McDonnel say plotter are use `` dark art '' to destabilis Labour 's leader .,bbc-news
15,Simon Cowell burglary: Man guilty of stealing £1m of gems,Simon Cowel had been asleep in the hous with hi famili when it wa broken into .,bbc-news
9,Leicester v Liverpool: Foxes' first game since Ranieri sacking,"Text and radio coverag as Leicest , without the sack Claudio Ranieri , take on Liverpool , who can go third with a win .",bbc-sport
9,England v Italy: World Rugby says it is 'too early to speculate on law changes',"It is `` too earli to specul '' on rule chang after Itali use controversi tactic against England , say the sport 's govern bodi .",bbc-sport
9,Lewis Hamilton fastest for Mercedes on first pre-season testing day,Merced and Ferrari enjoy impress start to pre-season test as Red Bull and McLaren hit troubl .,bbc-sport
9,Craig Shakespeare: Leicester caretaker boss in frame to get job on permanent basis,Caretak boss Craig Shakespear is firmli in content for the Leicest manag 's job on a longer-term basi after Claudio Ranieri 's sack .,bbc-sport
9,David Wagner and Garry Monk banned by FA after touchline altercation,"Huddersfield boss David Wagner is given a two-match touchlin ban and a £6,000 fine after hi alterc with Leed counterpart Garri Monk .",bbc-sport
9,"Italy, Ruck-gate and 'The Chaos Theory', 5 live’s Rugby Union Weekly - BBC Radio 5 live",Ugo and Chri on Itali frustrat England with their innov tactic at the ruck .,bbc-sport
9,Rowing: Triple Olympic champion Andrew Triggs-Hodge retires,Britain 's tripl Olymp champion Andrew Triggs-Hodg announc hi retir from row .,bbc-sport
9,Roger Federer beats Benoit Paire on return to action at Dubai Championships,Roger Feder win hi Dubai Tenni Championship open against Franc 's Benoit Pair in just 54 minut .,bbc-sport
9,England Lions: Liam Livingstone matches feat achieved by Kevin Pietersen,"England Lion lose their second four-day match with Sri Lanka A , but Liam Livingston match a feat achiev by Kevin Pietersen .",bbc-sport
9,"Alex Young: Former Hearts, Everton & Scotland forward dies, aged 80","Former Heart , Everton and Scotland forward Alex Young ha die at the age of 80 .",bbc-sport
6,Trump Tells Large Health Insurers to Expect ‘Something Special’,"Presid Donald Trump told major U.S. health insurers at a White Hous meet Monday to expect “someth special” to replac Obamacar , as the administr get more involv in Republican effort to repeal the health-car law .",bloomberg
3,Mexico Warns U.S. It'll Cut Off Nafta Talks If Tariffs Added,Mexico Warn U.S. It 'll Cut Off Nafta Talk If Tariff Ad,bloomberg
13,"As Wall Street Thrives, America's Little Guy Chokes on Paperwork","If some American bank are too big to fail , other have begun to feel they’r too small to succeed .",bloomberg
13,Tesla Tanks After Goldman Downgrades to Sell,Tesla Inc. fell 5 percent after Goldman Sach Group Inc. turn neg on the stock and cast doubt on Chairman Elon Musk’ abil to deliv the company’ new vehicl on time .,bloomberg
13,Warren Buffett Sees Republicans Needing to Dial Back Their Tax Plan Ambitions,"Warren Buffett cast doubt on a controversi centerpiec of Hous Speaker Paul Ryan’ tax overhaul plan , say the measur would lead to higher price for consum and like be scale back becaus it’ too polit contenti .",bloomberg
13,Earth’s Orbiting Junkyard Threatens the Space Economy,Rocket and satellit litter is endang privat space commerce. Enter the cosmic debri track industri .,bloomberg
13,Infrastructure Stocks Climb as Trump Pledges to Spend 'Big',"Presid Donald Trump breath some life back into beaten-down stock that have been seen as benefit from higher spend on highway and bridg , promis to spend",bloomberg
5,Let the Red Carpet Knockoff War Begin,"The Oscar are over , but the legal battl to protect those stun dress is just start .",bloomberg
10,"After Google Grounds Its Drone Project, Facebook Ramps Up Flights","While Googl shutter its Titan drone project , Facebook Inc. is plan to ramp up test flight for it own experiment solar-pow glider .",bloomberg
3,Seoul Says North Korea Executed 5 Senior Security Officials,"Seoul , South Korea ( AP ) -- North Korea execut five senior secur offici with anti-aircraft gun becaus they made fals report that",bloomberg
